{
  "page": "Capa LOB Summary",
  "version": "lob@2026-10-22",
  "groups": [
    ["here", "이 화면에서", "HOME 안에서 끝나는 일"],
    ["change", "LOB 숫자를 바꾸려면", "다른 화면에서 값을 고쳐 HOME 에 반영"],
    ["keep", "바꾼 값을 남기려면", "리비전 저장 → 공식버전 지정"]
  ],
  "state_pick": [
    {"badge": "미저장 변경", "tone": "pending", "say": "고친 값이 지금 창에만 있어요. 창을 닫으면 사라집니다.", "go": "save_revision"},
    {"badge": "저장된 리비전", "tone": "saved", "say": "리비전으로 남았어요. 모두가 기본으로 보게 하려면 공식버전으로 지정합니다.", "go": "set_official"},
    {
      "badge": "공식 vN",
      "tone": "official",
      "say": "지금 보는 것이 최신 공식버전이에요(옛 공식버전을 불러오면 「저장된 리비전」으로 보여요). 값을 바꾸려면 아래 「LOB 숫자를 바꾸려면」에서 시작합니다.",
      "go": "lob_map"
    }
  ],
  "tasks": [
    {
      "id": "lob_map",
      "group": "here",
      "kind": "map",
      "title": "LOB 숫자가 어디서 오는지 보기",
      "sub": "숫자를 누르면 그 값을 고치는 곳으로 안내합니다",
      "reach": "보기",
      "screens": ["HOME"],
      "thumb": {"state": "01_home_main", "targets": ["lob_chart"]},
      "map": {
        "state": "01_home_main",
        "frame": ["lob_density", "lob_wafer_plan", "lob_wafer_capa", "lob_bn_bars"],
        "spots": [
          {
            "t": "lob_density",
            "row": true,
            "name": "Density (억Gb)",
            "what": "생산 계획(PKG 수량)을 Density 로 환산한 값",
            "from": ["PKG PLAN", "수율"],
            "go": "change_plan"
          },
          {
            "t": "lob_wafer_plan",
            "row": true,
            "name": "Wafer 계획",
            "what": "생산 계획을 Wafer 로 환산한 값",
            "from": ["PKG PLAN", "수율"],
            "go": "change_plan"
          },
          {
            "t": "lob_wafer_capa",
            "row": true,
            "name": "Wafer Capa",
            "what": "Wafer 계획 × 그 달 B/N 공정의 확보율. 확보율 = 가용대수 ÷ 소요대수이고, 가용대수는 기준 정보 › 설비대수 › 가용 에서만 옵니다",
            "from": ["Wafer 계획", "가용대수", "UPEH · 효율 · 여유율 · 일수", "공정 필터"],
            "go": "change_avail"
          },
          {
            "t": "lob_bn_bars",
            "name": "B/N 공정 막대 색",
            "what": "그 달 가장 모자란 공정(B/N)의 확보율 색 — 확보는 회색, 경고는 주황, 부족은 빨강",
            "from": ["가용대수 ÷ 소요대수", "판정 기준(%)"],
            "go": "change_avail"
          }
        ],
        "color": {"what": "B/N 막대 · 히트맵의 확보 · 경고 · 부족 색을 가르는 기준(%)", "go": "criteria"}
      }
    },
    {
      "id": "bn_drill",
      "group": "here",
      "title": "B/N 공정을 깊이 보기",
      "sub": "칸을 누르면 그 공정의 산출 근거와 부족한 달이 열립니다",
      "reach": "보기",
      "screens": ["HOME", "공정 Capa 상세"],
      "thumb": {"state": "02_home_lower", "targets": ["detail_bn"]},
      "steps": [
        {
          "id": "pick_cell",
          "title": "부족한 공정 칸을 누릅니다",
          "where": ["HOME", "Main", "상세 B/N 공정"],
          "state": "02_home_lower",
          "focus": [{"t": "bn_cell", "n": 1}, {"t": "detail_bn", "kind": "see", "frame": false}],
          "do": "「상세 B/N 공정」(또는 「주요공정」 히트맵)에서 보고 싶은 칸을 누릅니다. 빨간 칸이 부족한 달이에요.",
          "stuck": ["과거 실적 달 · 연간 Total 칸 → 눌러도 옮겨 가지 않아요. 앞으로의 월 칸을 누르세요."]
        },
        {
          "id": "read_detail",
          "title": "산출 근거와 부족한 달을 봅니다",
          "where": ["실행 관리", "공정 Capa 상세"],
          "state": "03_process_detail",
          "focus": [{"t": "proc_card", "n": 1, "kind": "see"}, {"t": "month_canvas", "n": 2, "kind": "see"}],
          "do": "공정 이름과 달별 칸을 봅니다. 빨간(부족) 칸이 모자라는 달입니다.",
          "ok": "이 화면은 읽기 전용입니다. 값을 고치는 곳은 ((기준 정보)) 예요."
        },
        {
          "id": "back_home",
          "title": "HOME 으로 돌아갑니다",
          "where": ["공정 Capa 상세"],
          "state": "03_process_detail",
          "focus": [{"t": "back_home", "n": 1}],
          "do": "[[HOME]] 을 누르면 보던 HOME 으로 돌아갑니다."
        }
      ],
      "end": "아무것도 바뀌지 않았습니다(보기만 했어요).",
      "next": ["change_avail"]
    },
    {
      "id": "proc_filter",
      "group": "here",
      "title": "B/N 판정에 넣을 공정 좁히기",
      "sub": "공정 필터로 B/N 을 찾을 공정만 남깁니다",
      "reach": "적용",
      "screens": ["HOME"],
      "thumb": {"state": "04_procfilter_open", "targets": ["pf_tiles"]},
      "steps": [
        {
          "id": "open",
          "title": "「공정 필터」 칸을 엽니다",
          "where": ["사이드바", "공정 필터"],
          "state": "01_home_main",
          "focus": [{"t": "sidebar_procfilter", "n": 1}],
          "do": "사이드바의 [[공정 필터]] 칸을 누릅니다."
        },
        {
          "id": "toggle",
          "title": "공정을 끄고 켭니다",
          "where": ["공정 필터"],
          "state": "04_procfilter_open",
          "focus": [{"t": "pf_tiles", "n": 1}, {"t": "pf_all_on", "n": 2}],
          "do": "타일을 눌러 공정을 끄거나 켭니다. [[전체 ON]] 으로 처음부터 다시 고를 수 있어요."
        },
        {
          "id": "apply",
          "title": "「선택 공정 적용」을 누릅니다",
          "where": ["공정 필터"],
          "state": "04_procfilter_open",
          "focus": [{"t": "pf_apply", "n": 1}],
          "do": "[[선택 공정 적용]] 을 눌러야 HOME 의 B/N 이 다시 계산됩니다.",
          "ok": "사이드바 칸에 「n / N 공정」(모두 켜면 「전체 N공정」)이 보입니다.",
          "stuck": ["창을 그냥 닫았다 → 고른 것이 버려져요. 다시 열고 적용을 누르세요.", "리비전을 저장하면 이 공정 선택도 함께 담깁니다."]
        }
      ],
      "end": "지금 창의 HOME 판정만 바뀝니다. 사이드바 배지는 그대로지만, 리비전을 저장하면 이 공정 선택도 함께 남습니다.",
      "next": ["save_revision"]
    },
    {
      "id": "gap",
      "group": "here",
      "title": "이전 리비전과 비교하기(GAP)",
      "warn": "고른 비교 대상은 모든 사람에게 저장됩니다",
      "sub": "비교할 리비전을 고르고 GAP 을 켜면 Density · Wafer 계획 아래에 증감이 붙습니다",
      "reach": "공용",
      "screens": ["HOME"],
      "thumb": {"state": "20_home_pref_compare", "targets": ["pref_compare_scenario", "pref_compare_revision"]},
      "steps": [
        {
          "id": "pick_compare",
          "title": "Preference 탭에서 비교 대상을 고릅니다",
          "where": ["HOME", "Preference"],
          "state": "20_home_pref_compare",
          "focus": [{"t": "pref_compare_scenario", "n": 1}, {"t": "pref_compare_revision", "n": 2}],
          "do": "((Preference)) 탭 → [[비교 시나리오]] · [[비교 리비전]] 을 고릅니다.",
          "ok": "고르는 순간 저장됩니다(따로 저장 버튼이 없어요). 공용 값이라 모든 사람의 비교 대상이 함께 바뀝니다."
        },
        {
          "id": "back_main",
          "title": "Main 탭으로 돌아옵니다",
          "where": ["HOME", "Main"],
          "state": "01_home_main",
          "focus": [{"t": "tab_main", "n": 1}, {"t": "sidebar_lobcond", "n": 2, "kind": "see"}],
          "do": "((Main)) 탭을 누르면 사이드바에 「LOB 표시 조건」 카드가 나타납니다(Main 에서만 보여요)."
        },
        {
          "id": "gap_on",
          "title": "「LOB 표시 조건」에서 GAP 을 켭니다",
          "where": ["사이드바", "LOB 표시 조건"],
          "state": "05_lobcond_open",
          "focus": [{"t": "lc_gap", "n": 1}],
          "do": "접힌 [[LOB 표시 조건]] 카드를 펼쳐 [[GAP]] 을 켭니다. Density · Wafer 계획 줄 아래에 증감이 붙습니다.",
          "stuck": [
            "GAP 이 잠겨 있다 → 툴팁 「Preference 탭에서 비교 시나리오를 먼저 고르세요.」 — 1단계로 돌아가세요.",
            "같은 리비전을 고르면 증감이 모두 0 으로 나와요. 과거 실적 달에는 증감이 붙지 않습니다."
          ]
        }
      ],
      "end": "비교 대상은 공용으로 저장되어 모든 사람의 비교 · 입장 화면 Summary GAP 이 함께 바뀝니다. 계산 값은 그대로예요.",
      "next": []
    },
    {
      "id": "criteria",
      "group": "here",
      "warn": "모든 사람의 화면이 곧바로 바뀝니다",
      "title": "확보 · 경고 기준(%) 바꾸기",
      "sub": "B/N 막대 · 히트맵 색과 기준선을 정하는 값 — 공용 설정입니다",
      "reach": "공용",
      "screens": ["HOME"],
      "thumb": {"state": "06_home_pref", "targets": ["pref_criteria_inputs", "pref_criteria_save"]},
      "steps": [
        {
          "id": "find_box",
          "title": "Preference 탭의 「확보율 판정 기준」",
          "where": ["HOME", "Preference"],
          "state": "06_home_pref",
          "focus": [{"t": "pref_criteria_box", "n": 1, "kind": "see"}],
          "do": "((Preference)) 탭에서 「확보율 판정 기준」 상자를 찾습니다."
        },
        {
          "id": "edit_save",
          "title": "기준(%)을 고치고 저장합니다",
          "where": ["HOME", "Preference", "확보율 판정 기준"],
          "state": "06_home_pref",
          "focus": [{"t": "pref_criteria_inputs", "n": 1}, {"t": "pref_criteria_save", "n": 2}],
          "do": "[[기본 확보 기준(%)]] · [[기본 경고 기준(%)]] 을 고치고 위의 [[판정 기준 저장]] 을 누릅니다.",
          "ok": "「확보율 판정 기준을 공용 설정으로 저장했습니다.」",
          "stuck": ["「기본 경고 기준(X%)이 기본 확보 기준(Y%)보다 큽니다.」 → 경고 기준을 확보 기준 이하로 고치세요.", "리비전과 상관없이 모든 사람 · 모든 시나리오에 곧바로 걸립니다."]
        }
      ],
      "end": "모든 사람의 B/N 색 · Static Capa · 산출 결과 · 공정 Capa 상세 · 필요 단축 일정 · 입장 화면 Summary 판정이 함께 바뀝니다.",
      "next": []
    },
    {
      "id": "change_avail",
      "group": "change",
      "title": "확보율에 걸리는 가용대수 바꾸기",
      "sub": "기준 정보 › 설비대수 › 가용 을 고치면 HOME 확보율이 다시 계산됩니다",
      "reach": "적용",
      "screens": ["기준 정보", "HOME"],
      "thumb": {"state": "09_ref_edited", "targets": ["ref_edited_cell", "ref_apply"]},
      "steps": [
        {
          "id": "nav",
          "title": "「Static Capa」를 펼쳐 「기준 정보」로",
          "where": ["사이드바", "Static Capa", "기준 정보"],
          "state": "07_sidebar_static_open",
          "focus": [{"t": "nav_reference", "n": 1}],
          "do": "사이드바 ((Static Capa)) 상자를 펼치고 ((기준 정보)) 를 누릅니다.",
          "stuck": ["메뉴가 안 보인다 → 「Static Capa」 상자가 접혀 있어요. 상자 머리를 누르세요."]
        },
        {
          "id": "tabs",
          "title": "「설비대수」 → 「가용」 탭",
          "where": ["기준 정보", "설비대수", "가용"],
          "state": "08_ref_avail",
          "focus": [{"t": "tab_eqp", "n": 1}, {"t": "subtab_avail", "n": 2}, {"t": "subtab_own", "kind": "no"}],
          "do": "((설비대수)) 탭 → 안쪽 ((가용)) 탭을 고릅니다.",
          "stuck": ["「보유」 · 「대여」를 고치면 HOME 확보율은 그대로예요. HOME 은 「가용」만 읽습니다."]
        },
        {
          "id": "edit_cell",
          "title": "표의 칸을 고칩니다",
          "where": ["기준 정보", "설비대수", "가용"],
          "state": "09_ref_edited",
          "focus": [{"t": "ref_edited_cell", "n": 1}, {"t": "ref_change_notice", "n": 2, "kind": "see"}],
          "do": "고칠 달의 칸을 두 번 눌러(또는 칸을 고르고 바로 숫자 입력) 바꾸고 Enter 를 누릅니다.",
          "ok": "버튼 줄 오른쪽에 「변경사항 확인 N개 값 · M개 행」이 뜨고, 「설비대수」 · 「가용」 탭 이름 옆에 주황 점이 찍힙니다.",
          "stuck": ["원하는 달이 없다 → 사이드바 「조회기간」 밖의 달은 표에 나오지 않아요."]
        },
        {
          "id": "apply",
          "title": "「변경사항 적용」을 누릅니다",
          "where": ["기준 정보"],
          "state": "09_ref_edited",
          "focus": [{"t": "ref_apply", "n": 1}],